{
 "version": "1.0",
 "url": "http://127.0.0.1:8765/gif-hero/",
 "capturedAt": "2026-10-24T12:45:03Z",
 "engineVersion": "1.0.0",
 "settings": {
  "duration": 10,
  "viewport": {
   "width": 1024,
   "height": 768
  },
  "fps": 60,
  "redRule": "wcag22",
  "attribute": "bbox",
  "windowPx": {
   "width": 341,
   "height": 256
  },
  "cellPx": 4
 },
 "capture": {
  "strategy": "realtime",
  "deterministic": false,
  "frameCount": 600,
  "hash": "f50ba5cf50b58f79ab66a34704caceeb8c7c1ad97013fc49932be49c0758e5e1",
  "frameHashes": [
   "5d9155c77f51066006acc1d431929531cdaea17c0f9c5b2d6aa53226addfc433",
   "5d9155c77f51066006acc1d431929531cdaea17c0f9c5b2d6aa53226addfc433",
   "5d9155c77f51066006acc1d431929531cdaea17c0f9c5b2d6aa53226addfc433",
   "5d9155c77f51066006acc1d431929531cdaea17c0f9c5b2d6aa53226addfc433",
   "5d9155c77f51066006acc1d431929531cdaea17c0f9c5b2d6aa53226addfc433",
   "5d9155c77f51066006acc1d431929531cdaea17c0f9c5b2d6aa53226addfc433",
   "5d9155c77f51066006acc1d431929531cdaea17c0f9c5b2d6aa53226addfc433",
   "5d9155c77f51066006acc1d431929531cdaea17c0f9c5b2d6aa53226addfc433",
   "5d9155c77f51066006acc1d431929531cdaea17c0f9c5b2d6aa53226addfc433",
   "5d9155c77f51066006acc1d431929531cdaea17c0f9c5b2d6aa53226addfc433",
   "5d9155c77f51066006acc1d431929531cdaea17c0f9c5b2d6aa53226addfc433",
   "5d9155c77f51066006acc1d431929531cdaea17c0f9c5b2d6aa53226addfc433",
   "5d9155c77f51066006acc1d431929531cdaea17c0f9c5b2d6aa53226addfc433",
   "5d9155c77f51066006acc1d431929531cdaea17c0f9c5b2d6aa53226addfc433",
   "5d9155c77f51066006acc1d431929531cdaea17c0f9c5b2d6aa53226addfc433",
   "5d9155c77f51066006acc1d431929531cdaea17c0f9c5b2d6aa53226addfc433",
   "5d9155c77f51066006acc1d431929531cdaea17c0f9c5b2d6aa53226addfc433",
   "5d9155c77f51066006acc1d431929531cdaea17c0f9c5b2d6aa53226addfc433",
   "5d9155c77f51066006acc1d431929531cdaea17c0f9c5b2d6aa53226addfc433",
   "5d9155c77f51066006acc1d431929531cdaea17c0f9c5b2d6aa53226addfc433",
   "5d9155c77f51066006acc1d431929531cdaea17c0f9c5b2d6aa53226addfc433",
   "5d9155c77f51066006acc1d431929531cdaea17c0f9c5b2d6aa53226addfc433",
   "5d9155c77f51066006acc1d431929531cdaea17c0f9c5b2d6aa53226addfc433",
   "5d9155c77f51066006acc1d431929531cdaea17c0f9c5b2d6aa53226addfc433",
   "5d9155c77f51066006acc1d431929531cdaea17c0f9c5b2d6aa53226addfc433",
   "5d9155c77f51066006acc1d431929531cdaea17c0f9c5b2d6aa53226addfc433",
   "5d9155c77f51066006acc1d431929531cdaea17c0f9c5b2d6aa53226addfc433",
   "5d9155c77f51066006acc1d431929531cdaea17c0f9c5b2d6aa53226addfc433",
   "5d9155c77f51066006acc1d431929531cdaea17c0f9c5b2d6aa53226addfc433",
   "5d9155c77f51066006acc1d431929531cdaea17c0f9c5b2d6aa53226addfc433",
   "5d9155c77f51066006acc1d431929531cdaea17c0f9c5b2d6aa53226addfc433",
   "5d9155c77f51066006acc1d431929531cdaea17c0f9c5b2d6aa53226addfc433",
   "5d9155c77f51066006acc1d431929531cdaea17c0f9c5b2d6aa53226addfc433",
   "5d9155c77f51066006acc1d431929531cdaea17c0f9c5b2d6aa53226addfc433",
   "5d9155c77f51066006acc1d431929531cdaea17c0f9c5b2d6aa53226addfc433",
   "5d9155c77f51066006acc1d431929531cdaea17c0f9c5b2d6aa53226addfc433",
   "5d9155c77f51066006acc1d431929531cdaea17c0f9c5b2d6aa53226addfc433",
   "5d9155c77f51066006acc1d431929531cdaea17c0f9c5b2d6aa53226addfc433",
   "5d9155c77f51066006acc1d431929531cdaea17c0f9c5b2d6aa53226addfc433",
   "5d9155c77f51066006acc1d431929531cdaea17c0f9c5b2d6aa53226addfc433",
   "5d9155c77f51066006acc1d431929531cdaea17c0f9c5b2d6aa53226addfc433",
   "5d9155c77f51066006acc1d431929531cdaea17c0f9c5b2d6aa53226addfc433",
   "5d9155c77f51066006acc1d431929531cdaea17c0f9c5b2d6aa53226addfc433",
   "5d9155c77f51066006acc1d431929531cdaea17c0f9c5b2d6aa53226addfc433",
   "5d9155c77f51066006acc1d431929531cdaea17c0f9c5b2d6aa53226addfc433",
   "5d9155c77f51066006acc1d431929531cdaea17c0f9c5b2d6aa53226addfc433",
   "5d9155c77f51066006acc1d431929531cdaea17c0f9c5b2d6aa53226addfc433",
   "5d9155c77f51066006acc1d431929531cdaea17c0f9c5b2d6aa53226addfc433",
   "5d9155c77f51066006acc1d431929531cdaea17c0f9c5b2d6aa53226addfc433",
   "5d9155c77f51066006acc1d431929531cdaea17c0f9c5b2d6aa53226addfc433",
   "5d9155c77f51066006acc1d431929531cdaea17c0f9c5b2d6aa53226addfc433",
   "5d9155c77f51066006acc1d431929531cdaea17c0f9c5b2d6aa53226addfc433",
   "5d9155c77f51066006acc1d431929531cdaea17c0f9c5b2d6aa53226addfc433",
   "5d9155c77f51066006acc1d431929531cdaea17c0f9c5b2d6aa53226addfc433",
   "5d9155c77f51066006acc1d431929531cdaea17c0f9c5b2d6aa53226addfc433",
   "5d9155c77f51066006acc1d431929531cdaea17c0f9c5b2d6aa53226addfc433",
   "5d9155c77f51066006acc1d431929531cdaea17c0f9c5b2d6aa53226addfc433",
   "5d9155c77f51066006acc1d431929531cdaea17c0f9c5b2d6aa53226addfc433",
   "5d9155c77f51066006acc1d431929531cdaea17c0f9c5b2d6aa53226addfc433",
   "5d9155c77f51066006acc1d431929531cdaea17c0f9c5b2d6aa53226addfc433",
   "5d9155c77f51066006acc1d431929531cdaea17c0f9c5b2d6aa53226addfc433",
   "5d9155c77f51066006acc1d431929531cdaea17c0f9c5b2d6aa53226addfc433",
   "5d9155c77f51066006acc1d431929531cdaea17c0f9c5b2d6aa53226addfc433",
   "5d9155c77f51066006acc1d431929531cdaea17c0f9c5b2d6aa53226addfc433",
   "5d9155c77f51066006acc1d431929531cdaea17c0f9c5b2d6aa53226addfc433",
   "5d9155c77f51066006acc1d431929531cdaea17c0f9c5b2d6aa53226addfc433",
   "5d9155c77f51066006acc1d431929531cdaea17c0f9c5b2d6aa53226addfc433",
   "5d9155c77f51066006acc1d431929531cdaea17c0f9c5b2d6aa53226addfc433",
   "5d9155c77f51066006acc1d431929531cdaea17c0f9c5b2d6aa53226addfc433",
   "5d9155c77f51066006acc1d431929531cdaea17c0f9c5b2d6aa53226addfc433",
   "5d9155c77f51066006acc1d431929531cdaea17c0f9c5b2d6aa53226addfc433",
   "5d9155c77f51066006acc1d431929531cdaea17c0f9c5b2d6aa53226addfc433",
   "5d9155c77f51066006acc1d431929531cdaea17c0f9c5b2d6aa53226addfc433",
   "5d9155c77f51066006acc1d431929531cdaea17c0f9c5b2d6aa53226addfc433",
   "5d9155c77f51066006acc1d431929531cdaea17c0f9c5b2d6aa53226addfc433",
   "5d9155c77f51066006acc1d431929531cdaea17c0f9c5b2d6aa53226addfc433",
   "5d9155c77f51066006acc1d431929531cdaea17c0f9c5b2d6aa53226addfc433",
   "5d9155c77f51066006acc1d431929531cdaea17c0f9c5b2d6aa53226addfc433",
   "5d9155c77f51066006acc1d431929531cdaea17c0f9c5b2d6aa53226addfc433",
   "5d9155c77f51066006acc1d431929531cdaea17c0f9c5b2d6aa53226addfc433",
   "5d9155c77f51066006acc1d431929531cdaea17c0f9c5b2d6aa53226addfc433",
   "5d9155c77f51066006acc1d431929531cdaea17c0f9c5b2d6aa53226addfc433",
   "5d9155c77f51066006acc1d431929531cdaea17c0f9c5b2d6aa53226addfc433",
   "5d9155c77f51066006acc1d431929531cdaea17c0f9c5b2d6aa53226addfc433",
   "5d9155c77f51066006acc1d431929531cdaea17c0f9c5b2d6aa53226addfc433",
   "5d9155c77f51066006acc1d431929531cdaea17c0f9c5b2d6aa53226addfc433",
   "5d9155c77f51066006acc1d431929531cdaea17c0f9c5b2d6aa53226addfc433",
   "5d9155c77f51066006acc1d431929531cdaea17c0f9c5b2d6aa53226addfc433",
   "5d9155c77f51066006acc1d431929531cdaea17c0f9c5b2d6aa53226addfc433",
   "5d9155c77f51066006acc1d431929531cdaea17c0f9c5b2d6aa53226addfc433",
   "5d9155c77f51066006acc1d431929531cdaea17c0f9c5b2d6aa53226addfc433",
   "5d9155c77f51066006acc1d431929531cdaea17c0f9c5b2d6aa53226addfc433",
   "5d9155c77f51066006acc1d431929531cdaea17c0f9c5b2d6aa53226addfc433",
   "5d9155c77f51066006acc1d431929531cdaea17c0f9c5b2d6aa53226addfc433",
   "5d9155c77f51066006acc1d431929531cdaea17c0f9c5b2d6aa53226addfc433",
   "5d9155c77f51066006acc1d431929531cdaea17c0f9c5b2d6aa53226addfc433",
   "5d9155c77f51066006acc1d431929531cdaea17c0f9c5b2d6aa53226addfc433",
   "5d9155c77f51066006acc1d431929531cdaea17c0f9c5b2d6aa53226addfc433",
   "5d9155c77f51066006acc1d431929531cdaea17c0f9c5b2d6aa53226addfc433",
   "5d9155c77f51066006acc1d431929531cdaea17c0f9c5b2d6aa53226addfc433",
   "5d9155c77f51066006acc1d431929531cdaea17c0f9c5b2d6aa53226addfc433",
   "5d9155c77f51066006acc1d431929531cdaea17c0f9c5b2d6aa53226addfc433",
   "5d9155c77f51066006acc1d431929531cdaea17c0f9c5b2d6aa53226addfc433",
   "5d9155c77f51066006acc1d431929531cdaea17c0f9c5b2d6aa53226addfc433",
   "5d9155c77f51066006acc1d431929531cdaea17c0f9c5b2d6aa53226addfc433",
   "5d9155c77f51066006acc1d431929531cdaea17c0f9c5b2d6aa53226addfc433",
   "5d9155c77f51066006acc1d431929531cdaea17c0f9c5b2d6aa53226addfc433",
   "5d9155c77f51066006acc1d431929531cdaea17c0f9c5b2d6aa53226addfc433",
   "5d9155c77f51066006acc1d431929531cdaea17c0f9c5b2d6aa53226addfc433",
   "5d9155c77f51066006acc1d431929531cdaea17c0f9c5b2d6aa53226addfc433",
   "5d9155c77f51066006acc1d431929531cdaea17c0f9c5b2d6aa53226addfc433",
   "5d9155c77f51066006acc1d431929531cdaea17c0f9c5b2d6aa53226addfc433",
   "5d9155c77f51066006acc1d431929531cdaea17c0f9c5b2d6aa53226addfc433",
   "5d9155c77f51066006acc1d431929531cdaea17c0f9c5b2d6aa53226addfc433",
   "5d9155c77f51066006acc1d431929531cdaea17c0f9c5b2d6aa53226addfc433",
   "5d9155c77f51066006acc1d431929531cdaea17c0f9c5b2d6aa53226addfc433",
   "5d9155c77f51066006acc1d431929531cdaea17c0f9c5b2d6aa53226addfc433",
   "5d9155c77f51066006acc1d431929531cdaea17c0f9c5b2d6aa53226addfc433",
   "5d9155c77f51066006acc1d431929531cdaea17c0f9c5b2d6aa53226addfc433",
   "5d9155c77f51066006acc1d431929531cdaea17c0f9c5b2d6aa53226addfc433",
   "5d9155c77f51066006acc1d431929531cdaea17c0f9c5b2d6aa53226addfc433",
   "5d9155c77f51066006acc1d431929531cdaea17c0f9c5b2d6aa53226addfc433",
   "5d9155c77f51066006acc1d431929531cdaea17c0f9c5b2d6aa53226addfc433",
   "5d9155c77f51066006acc1d431929531cdaea17c0f9c5b2d6aa53226addfc433",
   "5d9155c77f51066006acc1d431929531cdaea17c0f9c5b2d6aa53226addfc433",
   "5d9155c77f51066006acc1d431929531cdaea17c0f9c5b2d6aa53226addfc433",
   "5d9155c77f51066006acc1d431929531cdaea17c0f9c5b2d6aa53226addfc433",
   "5d9155c77f51066006acc1d431929531cdaea17c0f9c5b2d6aa53226addfc433",
   "5d9155c77f51066006acc1d431929531cdaea17c0f9c5b2d6aa53226addfc433",
   "5d9155c77f51066006acc1d431929531cdaea17c0f9c5b2d6aa53226addfc433",
   "5d9155c77f51066006acc1d431929531cdaea17c0f9c5b2d6aa53226addfc433",
   "5d9155c77f51066006acc1d431929531cdaea17c0f9c5b2d6aa53226addfc433",
   "5d9155c77f51066006acc1d431929531cdaea17c0f9c5b2d6aa53226addfc433",